{
  "$schema": "./schemas/package.schema.json",
  "name": "goldstack-api",
  "template": "lambda-express",
  "deployments": [
    {
      "name": "dev",
      "awsRegion": "us-west-2",
      "awsUser": "goldstack-dev",
      "configuration": {
        "lambdaName": "goldstack-api",
        "apiDomain": "goldstack-api.dev.goldstack.party",
        "hostedZoneDomain": "dev.goldstack.party",
        "cors": "https://dev.goldstack.party",
        "goldstackWorkdir": "/tmp/",
        "stripeApiKey": "dummy"
      },
      "tfStateKey": "goldstack-api-dev-060f0ca6440485658cfc.tfstate",
      "tfVersion": "1.14.7"
    },
    {
      "name": "prod",
      "awsRegion": "us-west-2",
      "awsUser": "goldstack-prod",
      "configuration": {
        "lambdaName": "goldstack-api",
        "apiDomain": "goldstack-api.goldstack.party",
        "hostedZoneDomain": "goldstack.party",
        "cors": "https://goldstack.party",
        "goldstackWorkdir": "/tmp/",
        "stripeApiKey": "dummy"
      },
      "tfStateKey": "goldstack-api-prod-9c1fbe2ecc5fe14060c4.tfstate",
      "tfVersion": "1.14.7"
    }
  ],
  "templateVersion": "0.1.0",
  "configuration": {}
}
